,Texts,SWN Analysis,Emotions
405,"I really hate group assignments. I can't believe I actually got free riders in my group because I only heard about that before this and now it really happens to me. When I ask to discuss about the assignment and divide the work, the all ignored me and just seen my message. I know the assignment is difficult and they don't really understand it, but at least please just respond. I cried so hard because of this. Then I end up doing the assignment alone because the … See More",Positive,"{'Happy': 0.08, 'Angry': 0.08, 'Surprise': 0.46, 'Sad': 0.23, 'Fear': 0.15}"
406,"Hello, may i ask alumni from Bachelor of Economics, is it easy for you guys to find jobs? Is your job now related to your degree? Do share your job hunting experience",Positive,"{'Happy': 0.0, 'Angry': 0.0, 'Surprise': 0.17, 'Sad': 0.0, 'Fear': 0.83}"
407,right?,Neutral,"{'Happy': 0.0, 'Angry': 0.0, 'Surprise': 0.0, 'Sad': 0.0, 'Fear': 1.0}"
408,我认识你,Neutral,"{'Happy': 0, 'Angry': 0, 'Surprise': 0, 'Sad': 0, 'Fear': 0}"
409,HelloI am currently conducting my final year research on parenting styles. This survey will take approximately 20 minutes to complete.,Positive,"{'Happy': 0.0, 'Angry': 0.0, 'Surprise': 0.0, 'Sad': 0.0, 'Fear': 1.0}"
410,Sabah students have to get swab test 5 days before returning home and Sarawak students have to get swab test 3 days before returning home BUT how??? We cannot go out. Does Pusat Sejahtera provide swab test? Help...,Positive,"{'Happy': 0.4, 'Angry': 0.0, 'Surprise': 0.2, 'Sad': 0.4, 'Fear': 0.0}"
411,"I see other state's associations have their own group for students who want to go back but for Sarawak ones there is no one. Why??,· See original  · Rate this translation",Positive,"{'Happy': 0.0, 'Angry': 0.0, 'Surprise': 0.25, 'Sad': 0.25, 'Fear': 0.5}"
412,So my 1st year of degree ends like.... this? Oh wow and next thing I know becoming a senior oredy.... and then final year then graduate. This is not how I expect my and undergraduate studies to be but oh well who to blame?,Positive,"{'Happy': 0.25, 'Angry': 0.0, 'Surprise': 0.5, 'Sad': 0.0, 'Fear': 0.25}"
413,"Next year is my final year but, now i regret study this course, my interest in this subject really drop until now left nothing. Every subject next year is practical and thesis or fyp. When I thinj that i have to study for one more year i really hate myself and want to die.,LineHaya… See More",Positive,"{'Happy': 0.17, 'Angry': 0.0, 'Surprise': 0.5, 'Sad': 0.17, 'Fear': 0.17}"
414,多一个敌人，多一份危险，总有一天会再见面。,Neutral,"{'Happy': 0, 'Angry': 0, 'Surprise': 0, 'Sad': 0, 'Fear': 0}"
415,我很害怕....,Neutral,"{'Happy': 0, 'Angry': 0, 'Surprise': 0, 'Sad': 0, 'Fear': 0}"
416,"Boleh2 kafe **9 tak buka tengah hari, now I have to plan other under hot sun for my lunch....today is not lucky day....",Positive,"{'Happy': 0.67, 'Angry': 0.0, 'Surprise': 0.0, 'Sad': 0.33, 'Fear': 0.0}"
417,生日快乐 我对自己说,Neutral,"{'Happy': 0, 'Angry': 0, 'Surprise': 0, 'Sad': 0, 'Fear': 0}"
418,5v1,Neutral,"{'Happy': 0, 'Angry': 0, 'Surprise': 0, 'Sad': 0, 'Fear': 0}"
419,"那些只想 pass 不想 A 的人， please, 不要害别人，别来usm, 求求你。",Neutral,"{'Happy': 0.0, 'Angry': 0.0, 'Surprise': 0.0, 'Sad': 1.0, 'Fear': 0.0}"
420,"Finally meet the end,",Neutral,"{'Happy': 0.0, 'Angry': 0.0, 'Surprise': 0.0, 'Sad': 0.0, 'Fear': 1.0}"
425,很奇怪为什么到现在USM都还没有公布final考试成绩的公布日期 最后一年了很需要那个letter of completion赶快找工作啊啊啊啊啊,Neutral,"{'Happy': 0, 'Angry': 0, 'Surprise': 0, 'Sad': 0, 'Fear': 0}"
426,有些人觉得念大学就是念大学，不需要社交，但是我觉得社交也很重要，在社交圈里选择适合自己的朋友，从彼此身上学习或了解不一样的东西,Neutral,"{'Happy': 0, 'Angry': 0, 'Surprise': 0, 'Sad': 0, 'Fear': 0}"
428,Is there any ways that usm can provide students vaccine before students go back to hometown?,Neutral,"{'Happy': 0, 'Angry': 0, 'Surprise': 0, 'Sad': 0, 'Fear': 0}"
430,被困在campus 的第n天...,Neutral,"{'Happy': 0, 'Angry': 0, 'Surprise': 0, 'Sad': 0, 'Fear': 0}"
431,This is wat u call a quality song https://youtu.be/TQg47fXwj_Q… See More,Positive,"{'Happy': 0, 'Angry': 0, 'Surprise': 0, 'Sad': 0, 'Fear': 0}"
432,"Humans don't have customs, rude, USM quickly operates again, send people like this back quickly, trouble people only.... better for them.....,· See original  · Rate this translation",Positive,"{'Happy': 0.0, 'Angry': 0.0, 'Surprise': 0.17, 'Sad': 0.5, 'Fear': 0.33}"
433,Kirakira pikapika mofumofu nadenade guruguru gorogoro wakuwaku uzuuzu noronoro urouro tekuteku kosokoso sunsun peropero niconico batabata… See More,Neutral,"{'Happy': 0, 'Angry': 0, 'Surprise': 0, 'Sad': 0, 'Fear': 0}"
434,Iq without eq makes you an irritable nerd,Negative,"{'Happy': 0.0, 'Angry': 0.0, 'Surprise': 0.0, 'Sad': 0.5, 'Fear': 0.5}"
435,"Hello to everyone, I am veli  doubtful  come to accepting  JPA offer. Please help me answer a few questions of mine. Arigato in advanced",Negative,"{'Happy': 0.0, 'Angry': 0.0, 'Surprise': 0.2, 'Sad': 0.2, 'Fear': 0.6}"
436,"Just know the original song name is akari ga yatte kita zo by Gyari ft. Kizuna Akari… See More,Why no elite version",Positive,"{'Happy': 0, 'Angry': 0, 'Surprise': 0, 'Sad': 0, 'Fear': 0}"
437,我想说随便乱做东西的队友，你有想过你认真做东西的队友的感受吗？要pass而已的话，你一早可以先讲的，至少不会害到你队友，可以去找跟你有同样理想的人。,Neutral,"{'Happy': 0, 'Angry': 0, 'Surprise': 0, 'Sad': 0, 'Fear': 0}"
438,有伤心到。。当我身边的人拿的grade都比我高，那种不平衡心理一下子就出来了。。极力在说服自己还有机会超越他们，可是说服不了啊,Neutral,"{'Happy': 0, 'Angry': 0, 'Surprise': 0, 'Sad': 0, 'Fear': 0}"
439,you smile and joke around in front of your family,Positive,"{'Happy': 0.67, 'Angry': 0.0, 'Surprise': 0.33, 'Sad': 0.0, 'Fear': 0.0}"
440,"Hi 学长学姐好，想借用这个平台请教USM 的科系。本人是STPM生，目标是就读音乐系, 于是正在找国立大学有offer 音乐系的。 我本身是没有学过西乐，也没有任何音乐文凭，只是有学过华乐笛子。想问问USM 的音乐系是不是 有提供music foundation 给没有乐理知识但又想就读音乐系的学生呢？",Neutral,"{'Happy': 0.0, 'Angry': 0.0, 'Surprise': 0.0, 'Sad': 0.0, 'Fear': 1.0}"
441,下个sem就year 2了 还没去过usm,Neutral,"{'Happy': 0, 'Angry': 0, 'Surprise': 0, 'Sad': 0, 'Fear': 0}"
442,什么？原来这是meeting啊？ 我以为这是直播间，我们进去是看TA们聊天的。,Neutral,"{'Happy': 0, 'Angry': 0, 'Surprise': 0, 'Sad': 0, 'Fear': 0}"
443,Where can I file a complain against a lecturer if he/she gives coursework grades without even looking at my submitted work?,Neutral,"{'Happy': 0.0, 'Angry': 0.0, 'Surprise': 0.0, 'Sad': 0.33, 'Fear': 0.67}"
444,"Those students, particularly those that are of male gender have to know the boundary. There are many cases they've been harassing other female students, bombarding them with messages once they get hold of their numbers, trying to get a girl friend even a lot of them are married. This is an inappropriate thing to do. You come here to study, not creating this kind of nonsense.",Negative,"{'Happy': 0.33, 'Angry': 0.0, 'Surprise': 0.33, 'Sad': 0.17, 'Fear': 0.17}"
445,Any youtuber/YouTube content creators among usm students?please recommend,Neutral,"{'Happy': 0.0, 'Angry': 0.0, 'Surprise': 0.5, 'Sad': 0.0, 'Fear': 0.5}"
446,100% brain,Neutral,"{'Happy': 0, 'Angry': 0, 'Surprise': 0, 'Sad': 0, 'Fear': 0}"
447,MANA ORANG PERAKKK?? … See More,Neutral,"{'Happy': 0, 'Angry': 0, 'Surprise': 0, 'Sad': 0, 'Fear': 0}"
448,多数政府大学的同学都是来自form 6吧,Neutral,"{'Happy': 0, 'Angry': 0, 'Surprise': 0, 'Sad': 0, 'Fear': 0}"
449,"I see a lot of discrimination towards diploma students. I am a former diploma student, currently a degree student in USM. I believe there are no differences in our knowledge. In fact, we as diploma students might possess knowledge that you do not know. You might know something we do not know. University is a place for exchange of information, knowledge in specific, or else why did you attend university in the first place? Let's drop our background, whether you a… See More",Positive,"{'Happy': 0.0, 'Angry': 0.25, 'Surprise': 0.12, 'Sad': 0.25, 'Fear': 0.38}"
450,Politic now be like...,Positive,"{'Happy': 0, 'Angry': 0, 'Surprise': 0, 'Sad': 0, 'Fear': 0}"
451,"To be clerify, i am not siding any politician, including Dato Seri Najib.",Neutral,"{'Happy': 0, 'Angry': 0, 'Surprise': 0, 'Sad': 0, 'Fear': 0}"
452,"Those who criticize someone just because they expressed their dissatisfaction and anger here, let me tell you something. You do realize this is what we called confession right? Even this platform is called usm confession right? And you do know that these people are unable to express and share their feelings to their friends and family just because they would feel like a burden. And this is why they express their anger in here because this is the only platform th… See More",Negative,"{'Happy': 0.07, 'Angry': 0.0, 'Surprise': 0.27, 'Sad': 0.4, 'Fear': 0.27}"
453,以后junior 要租外面的房子 可以试试看呢,Neutral,"{'Happy': 0, 'Angry': 0, 'Surprise': 0, 'Sad': 0, 'Fear': 0}"
454,"I saw this on tik tok, guys im scared",Neutral,"{'Happy': 0.0, 'Angry': 0.0, 'Surprise': 0.0, 'Sad': 1.0, 'Fear': 0.0}"
455,太郁闷了。功课真的被另外的学生抄了。想了那么久的idea。就这样经老师的手被她分享给她的朋友。她的朋友还是我的同学。这是什么辈分呢。不帮不行，帮了自己委屈。世界怎么就那么黑暗的。做人还是少都点书。不管工作还是读书都那么不公平的。坐享其成的人，多了个去了。只想问那些抄的人，拿别人功課当example的人，良心不痛吗？还是你根本没有良心。,Neutral,"{'Happy': 0, 'Angry': 0, 'Surprise': 0, 'Sad': 0, 'Fear': 0}"
456,really wanna join palapes but overweight ... does any senior know whether palapes will recruit those who exceed the bmi limit? and does the fitness test difficult?,Positive,"{'Happy': 0.0, 'Angry': 0.0, 'Surprise': 0.5, 'Sad': 0.25, 'Fear': 0.25}"
457,Sota Year 1 sem 2 的 Lee****** 你好可爱 听说你很喜欢跳舞 等回campus 我陪你一起跳舞好不好,Neutral,"{'Happy': 0.0, 'Angry': 0.0, 'Surprise': 1.0, 'Sad': 0.0, 'Fear': 0.0}"
458,有一个朋友不知道哪里来的优越感，一直说雪兰莪没有了槟城就会很惨。请问何以见得？,Neutral,"{'Happy': 0, 'Angry': 0, 'Surprise': 0, 'Sad': 0, 'Fear': 0}"
460,"Yo to the friend who stands on letting ppl release their anger, sadness and disappointment here (aka hate posting, for me it's similar)… See More",Negative,"{'Happy': 0.17, 'Angry': 0.0, 'Surprise': 0.0, 'Sad': 0.67, 'Fear': 0.17}"
461,快要考试了 来这里抒发一下心情,Neutral,"{'Happy': 0, 'Angry': 0, 'Surprise': 0, 'Sad': 0, 'Fear': 0}"
462,说的就是你,Neutral,"{'Happy': 0, 'Angry': 0, 'Surprise': 0, 'Sad': 0, 'Fear': 0}"
463,"我到底怎么了？,LineHayat愿意帮助你。虽然我们的支持服务尚未推出，但是我们想通过分享一些有用的资源来提供你精神上的支持。… See More",Neutral,"{'Happy': 0, 'Angry': 0, 'Surprise': 0, 'Sad': 0, 'Fear': 0}"
464,"Hi everyone, i came here to ask for advice because i dont like showing how i really feel to my friends to not keep them worried and id like to keep everyone around me happy so I do hope id get some idea about whats going on with me here: Today, unannounced, I was studying for my finals and my mind started wandering places in the past, I randomly remembered one certain memory and before i even realised it my heart started beating so fast, as if someone was clench… See More",Positive,"{'Happy': 0.15, 'Angry': 0.0, 'Surprise': 0.23, 'Sad': 0.23, 'Fear': 0.38}"
465,"Study week = 1 week, 7 days",Neutral,"{'Happy': 1.0, 'Angry': 0.0, 'Surprise': 0.0, 'Sad': 0.0, 'Fear': 0.0}"
466,"Hi admin can you please ask for printing service in usm that opens on Sunday? Thank youuu,· See original  · Rate this translation",Positive,"{'Happy': 0.0, 'Angry': 0.0, 'Surprise': 0.0, 'Sad': 0.25, 'Fear': 0.75}"
468,please suggest some good food you MUST try while in penang,Positive,"{'Happy': 0.5, 'Angry': 0.0, 'Surprise': 0.0, 'Sad': 0.5, 'Fear': 0.0}"
470,"想问下在拿着JPA PIDN的朋友们~ 如果terima了, 之后填form的时候需不需要填saksi?",Neutral,"{'Happy': 0, 'Angry': 0, 'Surprise': 0, 'Sad': 0, 'Fear': 0}"
471,I know I never blend in with you all that well. I'll accept that ignoring of almost everything I tried to chat. The cold shoulder is annoying. Moral of the story: never force yourself to blend in... It's fine to be alone too,Negative,"{'Happy': 0.17, 'Angry': 0.0, 'Surprise': 0.17, 'Sad': 0.5, 'Fear': 0.17}"
473,I just want to share my personal elevator etiquette.,Positive,"{'Happy': 0.0, 'Angry': 0.0, 'Surprise': 0.0, 'Sad': 0.5, 'Fear': 0.5}"
474,＃升学,Neutral,"{'Happy': 0, 'Angry': 0, 'Surprise': 0, 'Sad': 0, 'Fear': 0}"
475,Mechanical engineering 的senior们，你们都有用平板来做笔记或者是做作业吗？,Positive,"{'Happy': 0.0, 'Angry': 0.0, 'Surprise': 0.0, 'Sad': 0.0, 'Fear': 1.0}"
476,我很讨厌一种人 你需要他 问他东西的时候 他迟回复 或者seen你 又或者直接不看 等整个星期了 才seen 你 那时候你已经忘记了 然后需要你时就整天在线 一直问你 问了你 当他知道了他所要知道的答案 又是seen你 或者 一句谢谢 哦哦 都没有... 我有点不习惯和这样的人打交道叻,Neutral,"{'Happy': 0, 'Angry': 0, 'Surprise': 0, 'Sad': 0, 'Fear': 0}"
477,考完试就毕业了,Neutral,"{'Happy': 0, 'Angry': 0, 'Surprise': 0, 'Sad': 0, 'Fear': 0}"
478,女生们看过来,Neutral,"{'Happy': 0, 'Angry': 0, 'Surprise': 0, 'Sad': 0, 'Fear': 0}"
479,"I don't like the feeling where I don't understand what is my fault. Why I've been treated this way by people even the closest one to me. Why, just why? Is it my existence is wrong? I'm tired of being scapegoat. Just because I'm an emotional person, get angry easily, but it doesn't mean that I was angry and being emotional for no reason. Tf, I'm tired too. I just want you guys to understand me. Hear me out. Instead of making me worse. Instead making my mental sta… See More",Positive,"{'Happy': 0.08, 'Angry': 0.15, 'Surprise': 0.08, 'Sad': 0.46, 'Fear': 0.23}"
480,此文有点长，但我想只有写这篇文章才能抒发自己。疫情肆虐，每天我都听见救护车声彼起彼落。曾经认为理所当然的自由，全都变成了奢侈的想法。我对远在他乡的亲人很是想念，总盼着有一天大家可以战胜疫情，平安健在，开心团聚。曾经我有满满的负面想法，但想到身边的人，想到雨后天晴的那一天，想到我喜爱的事物，就好像没那么难过了 。虽然每天待在家里非常闷，但换个角度想，游子们有家还归不得，待在家的我们其实很幸运了。我常常看见此网页有人有想不开的念头，所以我希望有困难的人，就去寻求各方面帮助吧，千万别选择结束自己的人生，因为存活下来的人多数都说，结束自己生命前的那一刹那，都会后悔。那些怪政府，怪友族，怪天怪地的人，我想说，你自己又做好本分，保护好自己和家人了吗？（无恶意）我只想说，只要照顾好自己，存活到最后，就是赢家。最后，我希望我和我身边的人，还有看到帖子的你，都可以平安度过这场灾难。,Neutral,"{'Happy': 0, 'Angry': 0, 'Surprise': 0, 'Sad': 0, 'Fear': 0}"
481,无意间发现c**rse h*ro满满都是lect准备给我们的slide和tuto答案，到底是哪一个阴险的coursemate把他全部上载去c**rse h*ro！甚至有些还是班里其他人交的功课！很过分好吗，替lect心疼，好心好意准备答案给我们refer，却被这样滥用了。。这位朋友，你不要这样糟蹋lect的心血好吗。我推测他上载是因为要得到free access去view expert的答案  请大神告诉我如何report那个c**rse h*ro的户口,Positive,"{'Happy': 0, 'Angry': 0, 'Surprise': 0, 'Sad': 0, 'Fear': 0}"
482,其实用data看黄片在缴付电话费时会不会显示在电费单历史记录的，小女看了又有点担心怕家人发现到。,Neutral,"{'Happy': 0, 'Angry': 0, 'Surprise': 0, 'Sad': 0, 'Fear': 0}"
484,今日静思晨语分享：,Neutral,"{'Happy': 0, 'Angry': 0, 'Surprise': 0, 'Sad': 0, 'Fear': 0}"
485,Which state is the best I don't know lah,Positive,"{'Happy': 0.0, 'Angry': 0.0, 'Surprise': 0.5, 'Sad': 0.5, 'Fear': 0.0}"
486,Do anyone have experience doing masters or PhD? how's the career prospects in industry?Can do part-time?can do PhD out of leisure? PhD is a paid programme or scholarship funded?,Positive,"{'Happy': 0.0, 'Angry': 0.0, 'Surprise': 0.0, 'Sad': 0.0, 'Fear': 1.0}"
487,Final exam 真的很难熬啊,Neutral,"{'Happy': 0.0, 'Angry': 0.0, 'Surprise': 0.0, 'Sad': 0.0, 'Fear': 1.0}"
488,USM选人是不是看男的有型/帅，女的可爱/没？,Neutral,"{'Happy': 0, 'Angry': 0, 'Surprise': 0, 'Sad': 0, 'Fear': 0}"
489,就是有些人，你帮她/他当很好朋友，可你自己却可有可无的帮忙工具人。想到突然这个科目那个人也拿有人可以帮您，才想起这个人。只能说那个人有点傻，也或许是在装傻，看来他是把她看得很重要的朋友，才会二话不说就帮吧～那位仁兄好醒醒了，乐于帮助别人不是这样用的，你把她当很重要很要好的朋友，她呢？？ 你找人家当作没看到。还会为了找你帮忙突然回来找你安抚你，隔天找你帮忙，你什么也没抱怨，反而觉得帮她你开心，理解你的心情，你值得更好的啦～加油不要被欺负利用都不懂啊～,Neutral,"{'Happy': 0, 'Angry': 0, 'Surprise': 0, 'Sad': 0, 'Fear': 0}"
490,I'm so lost... Insomnia and focusing problem troubles for almost a month yet I'm still in the exam weeks. I feel like I'm eagerly need a counselor to talk to. Shud I keep it until get the exam done? Or shud I seek help from USM counsellors as soon as possible?,Negative,"{'Happy': 0.2, 'Angry': 0.0, 'Surprise': 0.2, 'Sad': 0.4, 'Fear': 0.2}"
491,请问如果成功apply KOK，然后下学期credit满了 在申请科系的时候可以drop吗？Or 需要填表格呢,Neutral,"{'Happy': 0, 'Angry': 0, 'Surprise': 0, 'Sad': 0, 'Fear': 0}"
493,Abt cp*11* exam today:,Positive,"{'Happy': 0, 'Angry': 0, 'Surprise': 0, 'Sad': 0, 'Fear': 0}"
494,"I hate to be anywhere. Feel like want to be alone. At house, with family- I don’t have peace, ya of course I get clothes, food, drink, and most importantly family’s love towards me (I guess so). At university, I don’t like to be around with any friends. I don’t know what to do. Nowadays, I hate myself and feel wanna d*e. But I want to live my life happily, if can I don’t want to depend on anyone…maybe one good job, one small house, and me with myself are enough … See More",Positive,"{'Happy': 0.31, 'Angry': 0.0, 'Surprise': 0.23, 'Sad': 0.31, 'Fear': 0.15}"
495,"Looking for a room to rent near USM, Penang (Sungai Dua, Gelugor...as long as near USM).",Neutral,"{'Happy': 0.0, 'Angry': 0.0, 'Surprise': 0.0, 'Sad': 0.0, 'Fear': 1.0}"
497,Any DRAMA &TEATER seniors here? Would like to pm and ask you all a few qs if you may?,Positive,"{'Happy': 0.0, 'Angry': 0.0, 'Surprise': 0.0, 'Sad': 0.0, 'Fear': 1.0}"
499,人生中唯一 一次的青春，转眼间就这么结束了。真的是“就这么”就结束了。曾经幻想的热血，曾经幻想的冲动，不顾一切 转眼间已经烟消云散。… See More,Neutral,"{'Happy': 0, 'Angry': 0, 'Surprise': 0, 'Sad': 0, 'Fear': 0}"
500,看着大家都在问＂我cgpa 3.＋＋ 能不能进到什么什么科？＂,Neutral,"{'Happy': 0, 'Angry': 0, 'Surprise': 0, 'Sad': 0, 'Fear': 0}"
501,现在疫情状态，有什么工作适合半工半读Master吗？目前做了接近三年的工作需要加班 如果做着边读master更本应付不来，有什么方法呢？求解,Positive,"{'Happy': 0, 'Angry': 0, 'Surprise': 0, 'Sad': 0, 'Fear': 0}"
502,It’s kinda long and I’m sorry   first for all I love this community and I’m not trying to spread negativity just wanna raise some awareness.,Positive,"{'Happy': 0.17, 'Angry': 0.0, 'Surprise': 0.17, 'Sad': 0.33, 'Fear': 0.33}"
507,《Chocolate》,Neutral,"{'Happy': 0, 'Angry': 0, 'Surprise': 0, 'Sad': 0, 'Fear': 0}"
509,要毕业，也等于要失业了。我想要读master我想去外国进修，但是我没有钱。如果一直打工，我工钱可能不会太高。酱我要好久都存不到要去外国进修的费用（我讲的是美国，英国那些）. 你们有什么工作好介绍的？ 还是有没有sugar daddy mummy 的？我要钱！！！！！,Positive,"{'Happy': 0, 'Angry': 0, 'Surprise': 0, 'Sad': 0, 'Fear': 0}"
510,"I hate online exam!!! There are so much people are cheating. Even exam with proctoring, they still can place note on their table, and answer on their table. Camera only capture their face but not the material on their table and what they are doing on the table",Negative,"{'Happy': 0.25, 'Angry': 0.0, 'Surprise': 0.25, 'Sad': 0.25, 'Fear': 0.25}"
511,前阵子看到一篇关于“某些人”专门喜欢在帖子底下留言讽刺或批评谩骂的文章，说的非常有道理。我不是很明白为什么会有人自以为幽默就在帖子下留下不负责任的comment? 可能你以为你的留言会引起大家的注意和很有趣幽默，可是这样的风气对我来说有点恶心。也许有的人只是想抱怨和吐槽，希望有人来慰藉慰藉心灵，可楼下的哥哥姐姐弟弟妹妹们，你们扪心自问你们到底是关心还是想红？也想提醒你们，每当我看到有这种comment，我都会点开你们的profile看看是何方妖魔鬼怪，所以要吐槽批评负能量的话请重新匿名投稿，这样就不丢脸了，但如果你不怕丢脸那倒是无所谓。尤xx，你是不是在想该怎么批评这篇文章呢？最近你太猖狂了我无法忽视你，只不过问个问题你叫人家自己解决？能解决也不会被你看到了。当然有时候看到很有爱的comments，是打从心底感觉很温暖，人间处处有温暖，谢谢有心人。,Neutral,"{'Happy': 0, 'Angry': 0, 'Surprise': 0, 'Sad': 0, 'Fear': 0}"
513,疫情期间父母整天吵架，我真的是受不了了。,Neutral,"{'Happy': 0, 'Angry': 0, 'Surprise': 0, 'Sad': 0, 'Fear': 0}"
515,How are the foreign language courses?,Negative,"{'Happy': 0.0, 'Angry': 0.0, 'Surprise': 1.0, 'Sad': 0.0, 'Fear': 0.0}"
517,"各位学长学姐好，我STPM 4.0，,MUET Band 2， SPM 英文 D，我想问USM的管理系（如果放第一选择）有多大机会拿到？（因为我band 2而已，怕拿不到）… See More",Neutral,"{'Happy': 0.0, 'Angry': 0.0, 'Surprise': 0.0, 'Sad': 0.0, 'Fear': 1.0}"
518,How to end LDR,Neutral,"{'Happy': 0, 'Angry': 0, 'Surprise': 0, 'Sad': 0, 'Fear': 0}"
519,我不明白为什么有些人总爱播报自己的进度，事实上没有人有兴趣知道。,Neutral,"{'Happy': 0, 'Angry': 0, 'Surprise': 0, 'Sad': 0, 'Fear': 0}"
520,想问看SOM的senior们，可以在一个sem拿8 credit的minor的吗？,Neutral,"{'Happy': 0, 'Angry': 0, 'Surprise': 0, 'Sad': 0, 'Fear': 0}"
522,有科学家做过壁虎智力的研究吗？,Neutral,"{'Happy': 0, 'Angry': 0, 'Surprise': 0, 'Sad': 0, 'Fear': 0}"
523,"The semester break is getting closer. Many of you are planning to go back to your respective hometown. I am from RST hostel encouraging students to donate items if they want to throw away such as clothes, laundry detergent, food and stationery. Instead of throwing better give to others. One man's trash is another man's treasure. Thank You.",Positive,"{'Happy': 0.0, 'Angry': 0.4, 'Surprise': 0.2, 'Sad': 0.0, 'Fear': 0.4}"
525,perlis people scare caz we are like zombie to them,Positive,"{'Happy': 0, 'Angry': 0, 'Surprise': 0, 'Sad': 0, 'Fear': 0}"
526,今天真的很想跳下去，但还是没有。可能你会问我为什么。其实我也不太清楚，只是可能在那个时候找到了活下去的动力吧。感觉过去的自己总是为别人而活着，但是经过了这次，我却很希望自己能够有机会感受到看着自己一步一步成长的幸福感。我希望看到这个 post 的你能够好好地珍惜自己的存在，然后一步一步地走向未来更加优秀，坚强的自己，要相信自己是可以的。,Neutral,"{'Happy': 0, 'Angry': 0, 'Surprise': 0, 'Sad': 0, 'Fear': 0}"
527,"please allow every year 1 go back to the campus next year, if everyone is vaccinated",Positive,"{'Happy': 0.0, 'Angry': 0.0, 'Surprise': 0.0, 'Sad': 1.0, 'Fear': 0.0}"
528,Just wondering will USM provide vaccination to all the staff and students?,Positive,"{'Happy': 0.0, 'Angry': 0.0, 'Surprise': 1.0, 'Sad': 0.0, 'Fear': 0.0}"
531,Reply to #USMCFS26387 or #USMCFS26284… See More,Negative,"{'Happy': 0, 'Angry': 0, 'Surprise': 0, 'Sad': 0, 'Fear': 0}"
532,幸福不是財富多、權大、位高，而是自在、快樂、平安,Neutral,"{'Happy': 0, 'Angry': 0, 'Surprise': 0, 'Sad': 0, 'Fear': 0}"
533,"HFE 224 做第一题整个elearn 就down, 明明开始之前我试了都没问题。。。是elearn垃圾还是我样衰？",Neutral,"{'Happy': 0, 'Angry': 0, 'Surprise': 0, 'Sad': 0, 'Fear': 0}"
