,Texts,SWN Analysis,Emotions
1004,"I hope that there will be a M*P election online, maybe through campusonline or elearn platform. I mean, M*P will graduate too, but we still need M*P no matter we have f2f or online class, isn't it?",Negative,"{'Happy': 0.0, 'Angry': 0.0, 'Surprise': 0.33, 'Sad': 0.0, 'Fear': 0.67}"
1005,"#USMCFS27603 but in a meme version, mekasih.",Neutral,"{'Happy': 0, 'Angry': 0, 'Surprise': 0, 'Sad': 0, 'Fear': 0}"
1006,Hi. Does anyone know where can I buy USM lab coat? Thank you in advance .,Neutral,"{'Happy': 0, 'Angry': 0, 'Surprise': 0, 'Sad': 0, 'Fear': 0}"
1007,First time I get personal DMs to take down a certain comment on a certain topic.,Negative,"{'Happy': 0.0, 'Angry': 0.0, 'Surprise': 0.25, 'Sad': 0.0, 'Fear': 0.75}"
1008,"严峻时期还打算让学生回去f2f, 还说有70%的学生能回去, 第一个让我想到的是可能会有clxxxer subaidah UxM",Neutral,"{'Happy': 0, 'Angry': 0, 'Surprise': 0, 'Sad': 0, 'Fear': 0}"
1009,Cases are still high and KPT decides to open uni? Let's all get cov*d together in uni.,Negative,"{'Happy': 0.0, 'Angry': 0.0, 'Surprise': 0.0, 'Sad': 0.25, 'Fear': 0.75}"
1010,"Admin Botak, do you like your new admin job? Do you think you are suitable to become admin? Seriously, I miss old admins like admin Billy and admin Siao Zha Bo.",Positive,"{'Happy': 0.0, 'Angry': 0.0, 'Surprise': 0.33, 'Sad': 0.33, 'Fear': 0.33}"
1011,Does anyone has buy from samsung education store? wanna buy using samsung education discount but usm student email doesn't end with edu.my,Positive,"{'Happy': 0.0, 'Angry': 0.0, 'Surprise': 0.0, 'Sad': 0.5, 'Fear': 0.5}"
1012,"How i see the sentences these days in this page haha. But admin did those for a good reason, so please more positive confessions rather than negative ones ya guys",Positive,"{'Happy': 0.33, 'Angry': 0.0, 'Surprise': 0.0, 'Sad': 0.5, 'Fear': 0.17}"
1013,与病毒共存？我不要。Bio生们，就看你们的了。我就不信不会有清零的一天 。,Neutral,"{'Happy': 0, 'Angry': 0, 'Surprise': 0, 'Sad': 0, 'Fear': 0}"
1014,Highly philosophical meme indeed,Neutral,"{'Happy': 0.0, 'Angry': 0.0, 'Surprise': 0.0, 'Sad': 1.0, 'Fear': 0.0}"
1016,大佬们可以推荐新手wacom or huion绘画板吗? 本人不是art school生,Neutral,"{'Happy': 0, 'Angry': 0, 'Surprise': 0, 'Sad': 0, 'Fear': 0}"
1018,本人未来想去新加坡当药剂师， 可是知道新加坡只承认USM 的文凭，那么不是读USM 的（私人大学），要如何去那里当药剂师呢？有可能性吗？Can a pharmacist who graduated from private university to work at Singapore ? Any chance? Found out that  Singapore only recognised USM’s pharmacy degree course,Positive,"{'Happy': 0.0, 'Angry': 0.0, 'Surprise': 0.0, 'Sad': 0.0, 'Fear': 1.0}"
1019,"Admin can u post this, is it so wrong telling to arrange the tables",Negative,"{'Happy': 0.0, 'Angry': 0.0, 'Surprise': 0.0, 'Sad': 1.0, 'Fear': 0.0}"
1020,想请问有拿double degree的学长姐一些问题， 因为有些犹豫要不要拿,Negative,"{'Happy': 0, 'Angry': 0, 'Surprise': 0, 'Sad': 0, 'Fear': 0}"
1022,教师真没体谅心啊,Neutral,"{'Happy': 0, 'Angry': 0, 'Surprise': 0, 'Sad': 0, 'Fear': 0}"
1023,"K*T wants to open IPT back, bruh better not true cuz last time they make last minute decision i lost almost 3k, ni*ma you think the money fall from sky isit",Negative,"{'Happy': 0.0, 'Angry': 0.0, 'Surprise': 0.2, 'Sad': 0.4, 'Fear': 0.4}"
1024,Where to get professional help?,Positive,"{'Happy': 0.0, 'Angry': 0.0, 'Surprise': 1.0, 'Sad': 0.0, 'Fear': 0.0}"
1025,"无论是不是sem break, 我都在半夜才睡觉，每次都是在两点后，真的不想这么晚睡，可是怎么逼都逼不到自己睡，试过很多方法都不行。你们都是怎么逼自己睡的啊？",Neutral,"{'Happy': 0.0, 'Angry': 0.0, 'Surprise': 1.0, 'Sad': 0.0, 'Fear': 0.0}"
1026,USM真的要给我们回學校嗎？想到之前4到6月回去的時候在我房間隔壁的cube有人確診了还有所謂的*高層*叫我們不要說出去，我就覺得已經很不安全了，我知道可能是不要讓其他同學擔心，但他們應該有權利知道吧。就算打了2只疫苗，delta 變異病毒還是會突破感染的啊，一點都不安全好嗎？在說說有些同學的防疫意識真的很低，在4到6月的時候，有些人在食堂都沒有戴口罩溜哒，還喜歡在食堂裡群聚聊天。學校更可愛，既然讓來自不一樣的地區的人，2個人隔離在一間房間，隔離10天後也沒有做任何的冠病檢測。希望M*P 和校方真的要為學生的健康著想，感恩,Neutral,"{'Happy': 0, 'Angry': 0, 'Surprise': 0, 'Sad': 0, 'Fear': 0}"
1027,October gonna back to f2f soon…R u ready for various types of clxxter from UxM?,Negative,"{'Happy': 0.5, 'Angry': 0.0, 'Surprise': 0.0, 'Sad': 0.0, 'Fear': 0.5}"
1028,真不懂为什么这些韭菜一直都那么嚣张？马来西亚人就不能支持自己国家的选手吗？还是一定要一直发关于大zhong国最牛b的视频你们才甘愿？,Neutral,"{'Happy': 0, 'Angry': 0, 'Surprise': 0, 'Sad': 0, 'Fear': 0}"
1029,"对于吃到这么大还这么幼稚的人，该怎么解? Admin Botak, 你知道吗?教我。,Admin Botak",Neutral,"{'Happy': 0, 'Angry': 0, 'Surprise': 0, 'Sad': 0, 'Fear': 0}"
1030,"I don't know why posts with similar topic but with DIFFERENT CONTENTS need to be grouped and merged together into a single post by the admin. Sometimes, it is good to see how people react or comment on a post with a specific content. It didn't harm anyone in any way if the posts are separated either.",Positive,"{'Happy': 0.25, 'Angry': 0.0, 'Surprise': 0.25, 'Sad': 0.0, 'Fear': 0.5}"
1031,@admin botak,Neutral,"{'Happy': 0, 'Angry': 0, 'Surprise': 0, 'Sad': 0, 'Fear': 0}"
1032,"看了 #USMCFS27653 觉得很无助,什么也帮不到, 只希望你越来越好",Neutral,"{'Happy': 0, 'Angry': 0, 'Surprise': 0, 'Sad': 0, 'Fear': 0}"
1033,有木有追,Neutral,"{'Happy': 0, 'Angry': 0, 'Surprise': 0, 'Sad': 0, 'Fear': 0}"
1034,#USMCFS27643,Neutral,"{'Happy': 0, 'Angry': 0, 'Surprise': 0, 'Sad': 0, 'Fear': 0}"
1036,Who never go through this?,Negative,"{'Happy': 0, 'Angry': 0, 'Surprise': 0, 'Sad': 0, 'Fear': 0}"
1037,Just lose my 50/50 to Jean san,Negative,"{'Happy': 0.0, 'Angry': 0.0, 'Surprise': 0.0, 'Sad': 1.0, 'Fear': 0.0}"
1038,"Oppssss,Admin Botak: Can anyone cite its source?",Neutral,"{'Happy': 0, 'Angry': 0, 'Surprise': 0, 'Sad': 0, 'Fear': 0}"
1039,每个人在家里都必须完成自己负责的household chores。我知道这个是responsibility来的，所以我也没埋怨过，也不会说不开心，笑不出来。除此有做家务的人才知道父母不容易！所以大家要多做家务啊！知道吗？,Neutral,"{'Happy': 0, 'Angry': 0, 'Surprise': 0, 'Sad': 0, 'Fear': 0}"
1040,"It has been a while. And news flash, there's only one month left!,- Red Tomatoes",Negative,"{'Happy': 0.0, 'Angry': 1.0, 'Surprise': 0.0, 'Sad': 0.0, 'Fear': 0.0}"
1041,"Hello guys!,Thanks to those who participated in this survey. We need more responses from you guys. Those who have not responded yet, please help us ya. We really appreciate your cooperation.… See More",Positive,"{'Happy': 0.17, 'Angry': 0.0, 'Surprise': 0.33, 'Sad': 0.33, 'Fear': 0.17}"
1042,荧之空 Hotaru no sora,Neutral,"{'Happy': 0, 'Angry': 0, 'Surprise': 0, 'Sad': 0, 'Fear': 0}"
1043,"Holy sh*t, next semester coming soon",Negative,"{'Happy': 0, 'Angry': 0, 'Surprise': 0, 'Sad': 0, 'Fear': 0}"
1044,hmm,Neutral,"{'Happy': 0, 'Angry': 0, 'Surprise': 0, 'Sad': 0, 'Fear': 0}"
1045,"I change the date on my phone to cheat an app. And then i forgot. At that night as i was browsing usm confession page just to catch up latest news/gossip. I saw a few posts timeline was tomorrow at (time). Which made me think is usm confession able to predict time. Or am i special able to see the post that will be posted tomorrow.,Then the truth hits me. I changed my date settings. I'm not Dr Strange. … See More",Positive,"{'Happy': 0.0, 'Angry': 0.25, 'Surprise': 0.38, 'Sad': 0.25, 'Fear': 0.12}"
1046,Reply#USMCFS27833,Neutral,"{'Happy': 0, 'Angry': 0, 'Surprise': 0, 'Sad': 0, 'Fear': 0}"
1047,"haiya almost the start of the semester again. online lectures some more, same problem one",Negative,"{'Happy': 0.0, 'Angry': 0.0, 'Surprise': 0.0, 'Sad': 0.0, 'Fear': 1.0}"
1048,感觉自己一直被人家嫌弃，就算是认识比较长时间的人也是一样，不被讨喜。,Neutral,"{'Happy': 0, 'Angry': 0, 'Surprise': 0, 'Sad': 0, 'Fear': 0}"
1049,"I been thinking, what if time is not what we think of? what we normally think is there is a past, present and future. and some may think we all past present and future may happen simultaneously. so like if we go back to change the past, it will change the present and the future, but if we change the future, it doesnt effect the past or present (well depends on ur datum/reference point in time of course). but there is also talk like if we go and change our past, … See More",Negative,"{'Happy': 0.0, 'Angry': 0.0, 'Surprise': 0.46, 'Sad': 0.38, 'Fear': 0.15}"
1050,Fill in the box,Negative,"{'Happy': 0.0, 'Angry': 0.0, 'Surprise': 0.0, 'Sad': 0.0, 'Fear': 1.0}"
1051,Utk MAKLUMAN:,Neutral,"{'Happy': 0, 'Angry': 0, 'Surprise': 0, 'Sad': 0, 'Fear': 0}"
1052,"领国跟我们一样, 6~8月达到高峰期, 甚至比我们高.",Neutral,"{'Happy': 0, 'Angry': 0, 'Surprise': 0, 'Sad': 0, 'Fear': 0}"
1053,🥰,Neutral,"{'Happy': 0, 'Angry': 0, 'Surprise': 0, 'Sad': 0, 'Fear': 0}"
1054,听说Sarawak的朋友交通都是驾crocodile的,Neutral,"{'Happy': 0, 'Angry': 0, 'Surprise': 0, 'Sad': 0, 'Fear': 0}"
1055,"顺便一提还有一个""APEL""管道,#USMCFS27888… See More",Neutral,"{'Happy': 0, 'Angry': 0, 'Surprise': 0, 'Sad': 0, 'Fear': 0}"
1056,Old man still do meme after grad,Negative,"{'Happy': 0, 'Angry': 0, 'Surprise': 0, 'Sad': 0, 'Fear': 0}"
1057,So glad so many usm player hehe,Negative,"{'Happy': 1.0, 'Angry': 0.0, 'Surprise': 0.0, 'Sad': 0.0, 'Fear': 0.0}"
1058,cs school还是没有announce要f2f还是online,Neutral,"{'Happy': 0, 'Angry': 0, 'Surprise': 0, 'Sad': 0, 'Fear': 0}"
1060,"This pandemic will not end soon. We have 2 choices, either live with it or stay at home for another 2 years,- Go back campus… See More",Negative,"{'Happy': 0.0, 'Angry': 0.67, 'Surprise': 0.0, 'Sad': 0.33, 'Fear': 0.0}"
1061,.,Neutral,"{'Happy': 0, 'Angry': 0, 'Surprise': 0, 'Sad': 0, 'Fear': 0}"
1063,有时真的会觉得很累 为舍女生的待遇就是跟男生的不同 社会出现倒也不稀奇但是伤心的是其实是出现在我家,Neutral,"{'Happy': 0, 'Angry': 0, 'Surprise': 0, 'Sad': 0, 'Fear': 0}"
1064,"Reply to #USMCFS27943,可以试试联络他们哦",Neutral,"{'Happy': 0, 'Angry': 0, 'Surprise': 0, 'Sad': 0, 'Fear': 0}"
1066,Childhood moments,Neutral,"{'Happy': 0.0, 'Angry': 0.0, 'Surprise': 0.0, 'Sad': 0.0, 'Fear': 1.0}"
1067,"Hi, does anyone know if unpaid fees will affect course registration later?,I'm supposed to get exemption for Desasiswa's fee but HAC is taking too long to process it.",Positive,"{'Happy': 0.0, 'Angry': 0.0, 'Surprise': 0.0, 'Sad': 0.33, 'Fear': 0.67}"
1068,"Hi everyone, I just want to ask if I took less than 14 units courses on my fourth year, am I able to get dean list/first class degree based on my fourth year GPA?",Negative,"{'Happy': 0.0, 'Angry': 0.0, 'Surprise': 0.25, 'Sad': 0.25, 'Fear': 0.5}"
1069,Alright... which one of you is the reddit monyets. x malu asking for sos,Neutral,"{'Happy': 0.0, 'Angry': 0.0, 'Surprise': 0.0, 'Sad': 0.0, 'Fear': 1.0}"
1070,Who wan vomit sugar wif me?,Negative,"{'Happy': 0.0, 'Angry': 0.0, 'Surprise': 0.0, 'Sad': 1.0, 'Fear': 0.0}"
1071,"Hello everyone. I want to ask if i’m from usmkkj, i can only put foreign language course as code U or i can put as code M also? Thank you for answering",Negative,"{'Happy': 0.0, 'Angry': 0.0, 'Surprise': 0.25, 'Sad': 0.5, 'Fear': 0.25}"
1072,"Hi guys , can anybody explain this?  The core of community service said 4 credits in brackets , so can i just took the WSK 102 but i afraid that i found fulfill the requirement.",Positive,"{'Happy': 0.2, 'Angry': 0.0, 'Surprise': 0.4, 'Sad': 0.0, 'Fear': 0.4}"
1073,不管怎么样我都不可能回去的 与其要我回去感染病毒不如就在家感染病毒,Neutral,"{'Happy': 0, 'Angry': 0, 'Surprise': 0, 'Sad': 0, 'Fear': 0}"
1074,"So, kpt has stated 3 ways of returning to campus:",Neutral,"{'Happy': 0.0, 'Angry': 0.0, 'Surprise': 0.0, 'Sad': 1.0, 'Fear': 0.0}"
1075,"Dear N*rve C*ntre USM. pls do something, its been less than one month away from our sem1 21/22, what are u waiting for?",Negative,"{'Happy': 0.0, 'Angry': 0.33, 'Surprise': 0.67, 'Sad': 0.0, 'Fear': 0.0}"
1076,Put money in game is waste,Positive,"{'Happy': 0.0, 'Angry': 0.0, 'Surprise': 0.0, 'Sad': 1.0, 'Fear': 0.0}"
1077,should have joined as peserta then...,Neutral,"{'Happy': 0, 'Angry': 0, 'Surprise': 0, 'Sad': 0, 'Fear': 0}"
1078,"Would taking language course like japanese will need to go back school?,Admin Botak: No.",Neutral,"{'Happy': 0.0, 'Angry': 0.0, 'Surprise': 0.5, 'Sad': 0.0, 'Fear': 0.5}"
1079,这个帖子真的是美好心情终结者,Neutral,"{'Happy': 0, 'Angry': 0, 'Surprise': 0, 'Sad': 0, 'Fear': 0}"
1080,"So it's f2f learning or online learning in hostel? If f2f learning, how about students who didn't complete their vaccination and cannot go back to campus?",Positive,"{'Happy': 0, 'Angry': 0, 'Surprise': 0, 'Sad': 0, 'Fear': 0}"
1081,听说upu放榜了？有science edu的新生吗？下面留言一下,Neutral,"{'Happy': 0, 'Angry': 0, 'Surprise': 0, 'Sad': 0, 'Fear': 0}"
1082,有从selangor去usm kelantan分校的senior吗 可以分享下你们的感想吗,Neutral,"{'Happy': 0, 'Angry': 0, 'Surprise': 0, 'Sad': 0, 'Fear': 0}"
1083,本人真的不希望，但如果真的连最后一个sem都没办法回去，至少还有第一个sem的回忆。,Neutral,"{'Happy': 0, 'Angry': 0, 'Surprise': 0, 'Sad': 0, 'Fear': 0}"
1084,"Congratulations to the students on the successful enrolment in IPTAs. Welcome aboard to the School of Housing, Building and Planning (HBP), USM, for the *academic year of 2021/2022*.,A little background on HBP USM, it is home to seven undergraduate programs: … See More",Positive,"{'Happy': 0.33, 'Angry': 0.0, 'Surprise': 0.0, 'Sad': 0.33, 'Fear': 0.33}"
1085,"Confessions related to: Computer Science / IT,1) 想问看USM comp sc 是学什么language？ 0基础的人会难上手吗？(因为在matriks 没拿comp sc ) 可以建议用什么网站来学习吗？… See More",Negative,"{'Happy': 0.0, 'Angry': 0.0, 'Surprise': 1.0, 'Sad': 0.0, 'Fear': 0.0}"
1086,"Confessions related to: School of Management,1) I'm really confused. Can anyone help? I'm from school of management. last week just been informed that the learning and teaching will through online. Today saw the notice that we are going back to school berperingkat, then saw again untuk pelajar berkepeluan, then for all kategori...And lasts 17-23 October for senior to go back........So, do we need to go back?… See More",Positive,"{'Happy': 0.0, 'Angry': 0.0, 'Surprise': 0.4, 'Sad': 0.2, 'Fear': 0.4}"
1087,It's ok,Neutral,"{'Happy': 0, 'Angry': 0, 'Surprise': 0, 'Sad': 0, 'Fear': 0}"
1088,"As a responsible graduated senior memer hereby I repost this ancient post about laptop recommendation, that I think will suit all courses.",Positive,"{'Happy': 0.0, 'Angry': 0.0, 'Surprise': 0.5, 'Sad': 0.0, 'Fear': 0.5}"
1089,Platinum is gold,Negative,"{'Happy': 0, 'Angry': 0, 'Surprise': 0, 'Sad': 0, 'Fear': 0}"
1090,*sob* proud of admin,Neutral,"{'Happy': 0.5, 'Angry': 0.0, 'Surprise': 0.0, 'Sad': 0.5, 'Fear': 0.0}"
1091,"Usm的人以前spm是不是都是straight A? 没有straight A 在usm会不会被歧视？像是被觉得很差，不想成为队友，不想一起讨论学业之类的。我以前只有7A 而已。。但进到matric 而且拿到3.8。虽然有幸进到usm, 但觉得这里的人都很厉害，觉得自己不好。",Neutral,"{'Happy': 0, 'Angry': 0, 'Surprise': 0, 'Sad': 0, 'Fear': 0}"
1092,疫情生活让我失去了很多朋友。曾经的好朋友也变成了陌生人,Neutral,"{'Happy': 0, 'Angry': 0, 'Surprise': 0, 'Sad': 0, 'Fear': 0}"
1093,"Now I know why my siblings decided to move to other place to work after graduating. You can do whatever you want, go wherever you like without them knowing. Staying at home is just too stressful when your parents are strict, it’s like you have no freedom, whenever I go out they keep asking where who when why how and better come back before xx o’clock. (Am i childish and 叛逆 by saying like that ? Or am I old enough to have control of what I wanted to do ?) I’m the… See More",Positive,"{'Happy': 0.11, 'Angry': 0.11, 'Surprise': 0.11, 'Sad': 0.11, 'Fear': 0.56}"
1095,"Confessions related to minor course:,1. minor拿fine art会难吗？不会画画可以hold得住吗？… See More",Negative,"{'Happy': 0, 'Angry': 0, 'Surprise': 0, 'Sad': 0, 'Fear': 0}"
1096,Warm reminder: remember to register the courses,Positive,"{'Happy': 0.0, 'Angry': 0.0, 'Surprise': 0.0, 'Sad': 0.0, 'Fear': 1.0}"
1097,Hi! I heard we have to go to school office to fill out a form if we don’t meet the minimum units for that semester. Anyone knows the procedure?,Neutral,"{'Happy': 0.0, 'Angry': 0.0, 'Surprise': 0.0, 'Sad': 0.0, 'Fear': 1.0}"
1098,"在USM kejuruteraan kampus 容易找对象嘛，实不相瞒，我是来一边读书一边找对象的,Admin Botak: 嘛？ 吗？",Neutral,"{'Happy': 0, 'Angry': 0, 'Surprise': 0, 'Sad': 0, 'Fear': 0}"
1099,Back during the time we have mamak....,Neutral,"{'Happy': 0, 'Angry': 0, 'Surprise': 0, 'Sad': 0, 'Fear': 0}"
1100,:'),Neutral,"{'Happy': 0, 'Angry': 0, 'Surprise': 0, 'Sad': 0, 'Fear': 0}"
1101,All public university confession pages these days .,Negative,"{'Happy': 1.0, 'Angry': 0.0, 'Surprise': 0.0, 'Sad': 0.0, 'Fear': 0.0}"
1102,"Reply to #usmcfs28146 3),First, tomorrow register the course for the minor you want to change to through edaftar. Then email your academic advisor and tell her about you want to change your minor. Remember to get the borang pertukaran minor/ borang pendaftaran minor from your school and submit to the office.",Negative,"{'Happy': 0.0, 'Angry': 0.0, 'Surprise': 0.5, 'Sad': 0.5, 'Fear': 0.0}"
1103,有些人就是硬着要把他的话给讲完 就是不听下别人的立场 不给对方机会诉说,Neutral,"{'Happy': 0, 'Angry': 0, 'Surprise': 0, 'Sad': 0, 'Fear': 0}"
1104,No lie eh b4 MCO when I intern I got go gym eh ok,Positive,"{'Happy': 0, 'Angry': 0, 'Surprise': 0, 'Sad': 0, 'Fear': 0}"
1105,Jungle book,Negative,"{'Happy': 0.0, 'Angry': 0.0, 'Surprise': 0.0, 'Sad': 0.0, 'Fear': 1.0}"
1106,The govt: Those who finished 2 doses can go for vacation at Langkawi.,Neutral,"{'Happy': 0, 'Angry': 0, 'Surprise': 0, 'Sad': 0, 'Fear': 0}"
1107,>registering for subjects in unstable system,Negative,"{'Happy': 0.0, 'Angry': 0.0, 'Surprise': 0.0, 'Sad': 0.5, 'Fear': 0.5}"
1108,( ͡° ͜ʖ ͡°),Neutral,"{'Happy': 0, 'Angry': 0, 'Surprise': 0, 'Sad': 0, 'Fear': 0}"
1110,.,Neutral,"{'Happy': 0, 'Angry': 0, 'Surprise': 0, 'Sad': 0, 'Fear': 0}"
1111,"各位学长姐好，我想问如果我用Data来上网课可以吗？还是必须要WiFi？本身家里只有我一个人用，所以家人都觉得不是很需要安装Wifi。,Admin Botak:你data够用就可以",Neutral,"{'Happy': 0, 'Angry': 0, 'Surprise': 0, 'Sad': 0, 'Fear': 0}"
1114,"Confessions related to: SoLLaT/ SOLLAT (not solat),1) SOLLAT 是fully online吗… See More",Negative,"{'Happy': 0, 'Angry': 0, 'Surprise': 0, 'Sad': 0, 'Fear': 0}"
1115,"Confessions related to: USM Server problem,1) USM is ap*x, but campus online is like sh*t! No improvement plan, no update server, nothing! And u call urself ap*x … See More",Negative,"{'Happy': 0.0, 'Angry': 0.0, 'Surprise': 0.0, 'Sad': 0.0, 'Fear': 1.0}"
1116,"Confessions related to: U-course/ English/ Foreign Language （how to appeal, failed to register, and sad noises）,1) Guys, does anyone know when can rayuan LSP? Thanksyou!!! *Usm always is the best ya… See More",Negative,"{'Happy': 0.0, 'Angry': 0.0, 'Surprise': 0.5, 'Sad': 0.5, 'Fear': 0.0}"
1117,"Hi Seniors. New student here. There are a few questions i want to ask:,1. If I wish to change my course under the same school (Electronic to Mechatronic), is there any process that i need to go through? Is there any requirements on my results? And is there any interview needed? … See More",Negative,"{'Happy': 0.0, 'Angry': 0.0, 'Surprise': 0.0, 'Sad': 0.0, 'Fear': 1.0}"
1118,What's going to happen to USM Confession admins who lose anonymity? (eg. real name gets exposed) Will they lose their job?,Negative,"{'Happy': 0.0, 'Angry': 0.0, 'Surprise': 0.0, 'Sad': 0.75, 'Fear': 0.25}"
1119,"hi, want to ask if many students from usmkkj took arabic or not? i want to take chinese but both lac and laj full so i want to know if there’s student take laa cause laa seems to never run out of quota",Positive,"{'Happy': 0.0, 'Angry': 0.0, 'Surprise': 0.0, 'Sad': 0.5, 'Fear': 0.5}"
1120,这是我为某人特地去找出来的中文专有名词。我觉得很累啊，直接用英文表达更容易理解。那个telegram翻译不到！,Neutral,"{'Happy': 0, 'Angry': 0, 'Surprise': 0, 'Sad': 0, 'Fear': 0}"
1121,有没有nutrition的新生群 看到其他course都有群了 还是有nutrition senior可以给一些资料还是建议的 感激不尽,Positive,"{'Happy': 0, 'Angry': 0, 'Surprise': 0, 'Sad': 0, 'Fear': 0}"
1122,Senior们，请你们在底下comment你们的科系，方便我们这些新生找到自己科系的senior可以吗？因为我一直找不到,Neutral,"{'Happy': 0, 'Angry': 0, 'Surprise': 0, 'Sad': 0, 'Fear': 0}"
1123,school of cs confirm没得回去了吗？我是新生 如果不回校的话 我家里没有好的环境让我上网课 还是prefer回去的 真的没希望了吗,Positive,"{'Happy': 0.5, 'Angry': 0.0, 'Surprise': 0.0, 'Sad': 0.0, 'Fear': 0.5}"
1124,"哈咯，大家，我想问一下有没有本地大学转去另外的本地大学的例子吗？,我有个朋友STPM Bio Chem 系 CGPA 4.0的，upu拿到了UTHM的IT, 但是他想要转到USM, 是有办法的吗？除了 USM+1 以外。… See More",Neutral,"{'Happy': 0, 'Angry': 0, 'Surprise': 0, 'Sad': 0, 'Fear': 0}"
1125,为什么我朋友的kad siswa 下午submit上去那么快就accepted 料，我的星期五submit上去都还没accept gok.,Neutral,"{'Happy': 0, 'Angry': 0, 'Surprise': 0, 'Sad': 0, 'Fear': 0}"
1126,I am an exchange student to my new course of materials engineering next semester. Please anyone can provide me links to any groups that I need to attend? I tried finding in many places to no avail.,Positive,"{'Happy': 0.0, 'Angry': 0.0, 'Surprise': 0.2, 'Sad': 0.2, 'Fear': 0.6}"
1127,"I hope that USM will allow student that stay in desasiswa, to go outside campus. please consider student to have a free time to spend go outing. maybe set one day per week  for example, my friend from UiTM, their uni set a date for student to go outing.  as long as student completed vaccinated, sometime feel like not fair when student cant go out. spending money buy for basic things by food delivery, the fare are high. sometime the cafe provide foods that spoilage already.",Positive,"{'Happy': 0.25, 'Angry': 0.08, 'Surprise': 0.08, 'Sad': 0.17, 'Fear': 0.42}"
1128,"拿了2种外语的level 1, 快毕业了，但是两个外语的level 2 之后都crash到，能拿第三种外语的level 1吗？ 有人有过这样的经历，可以分享吗？ （From SOM）",Negative,"{'Happy': 0, 'Angry': 0, 'Surprise': 0, 'Sad': 0, 'Fear': 0}"
1129,各位USM的senior，你们有认识你哪一位比较帅的朋友可以tag他在下面吗？我想另他回家当男朋友,Neutral,"{'Happy': 0, 'Angry': 0, 'Surprise': 0, 'Sad': 0, 'Fear': 0}"
1130,"#USMCFS27846,Final reminder (25 September, 2021)… See More",Neutral,"{'Happy': 0.0, 'Angry': 0.0, 'Surprise': 0.0, 'Sad': 0.0, 'Fear': 1.0}"
1131,Missed my 50/50 to Jean but got her with one my last pull. She sure knows how to play hard to get hur. I'n gonna use your booba hard enough that it aches you!!!! HJL,Negative,"{'Happy': 0.0, 'Angry': 0.33, 'Surprise': 0.0, 'Sad': 0.33, 'Fear': 0.33}"
1132,Literally me 嫁妝230塊,Neutral,"{'Happy': 0, 'Angry': 0, 'Surprise': 0, 'Sad': 0, 'Fear': 0}"
1133,看到之前有女生要找学霸男友，我想请问你心中的学霸是怎样定义的？spm at least 10A+ and degree level cgpa 4.0 还是那种专科的？就是比如你数学不好你想找个奥林比克数学比赛金牌的人来教妳哈哈哈，不了解你要的学霸到底要多强，你没去定义你心中学霸的标准的话我们只能把他定义成成绩比你好一点就可算你心中的学霸。还有一点没有人能做得到全部科目都很够力的，我讲的够力是指一个人独自获得奥林比克数学和物理比赛全国金牌，编程大赛全国金牌，会计考试考进世界前三，三语会话全国第一，在我身旁我还没有遇过以上我讲的奖项都是由一个人获得罢了，独自一人能获得这些奖项的应该不是学霸了，是神仙哈哈哈。还有女生们你们也要去定义一个男生要多帅啊，不要只讲你们想找帅哥啊。帅的定义是什么？你们要去举例子的啊。杨洋，宋仲基，鹿晗这些在你们的眼里算帅吗？不然我们很多男生都不知道你们的帅是要到什么境界的。我们通常都会认为只要我们比身边的兄弟帅那我们就是帅哥了哈哈哈。,Negative,"{'Happy': 0, 'Angry': 0, 'Surprise': 0, 'Sad': 0, 'Fear': 0}"
1134,Anyone know TI senior need to back next sem? Why TI still not have any announcement regarding this?,Positive,"{'Happy': 1.0, 'Angry': 0.0, 'Surprise': 0.0, 'Sad': 0.0, 'Fear': 0.0}"
